{
  "version": 7,
  "timebase": {
    "numer": 125,
    "denom": 3
  },
  "t0Ns": "1000000000",
  "display": {
    "id": 1,
    "pointWidth": 640,
    "pointHeight": 360,
    "pixelWidth": 640,
    "pixelHeight": 360,
    "backingScale": 1,
    "originX": 0,
    "originY": 0
  },
  "capture": {
    "width": 640,
    "height": 360,
    "codec": "h264",
    "firstFrameNs": 0
  },
  "files": {
    "display": "display.mp4"
  },
  "stop": {
    "t": 5000000016,
    "reason": "user"
  },
  "geometry": [
    {
      "startNs": 0,
      "display": {
        "id": 1,
        "pointWidth": 640,
        "pointHeight": 360,
        "pixelWidth": 640,
        "pixelHeight": 360,
        "backingScale": 1,
        "originX": 0,
        "originY": 0
      },
      "contentRect": {
        "x": 0,
        "y": 0,
        "width": 640,
        "height": 360
      }
    },
    {
      "startNs": 3000000006,
      "display": {
        "id": 1,
        "pointWidth": 960,
        "pointHeight": 720,
        "pixelWidth": 1920,
        "pixelHeight": 1440,
        "backingScale": 2,
        "originX": 100,
        "originY": 0
      },
      "contentRect": {
        "x": 80,
        "y": 0,
        "width": 480,
        "height": 360
      }
    }
  ]
}
